{
  "artifactRef": null,
  "attempt": {
    "attemptNumber": 1,
    "idempotencyKey": "s05.smoke.export.83450daf67bf.f37cffd6196b.r2.a1",
    "partition": "smoke",
    "repetition": 2,
    "runId": "run.smoke.export.d914d75e54bb9b5e",
    "sourceId": "normalized.s05.export.smoke.003"
  },
  "contentHash": "78003bcfc28e5c5149af0d6445638cc2e679577b70f57ea35bd32418c857c3a4",
  "durationMs": null,
  "evidenceBoundary": {
    "c1": 0,
    "e1": 0,
    "formalEvidence": false,
    "g1": 0,
    "o1": 0,
    "productSupport": false,
    "r1Pipeline": 0,
    "r1ProductRelease": 0,
    "r1ProductValidation": 0,
    "releaseAllowlist": "none",
    "releaseApproved": 0,
    "releaseRegistered": 0,
    "u1": 0,
    "v1": 0
  },
  "expectedDisposition": "applicable",
  "expectedStableErrorCode": null,
  "finishedAt": "2026-08-15T04:52:08.824Z",
  "idempotencyKeyHash": "0e52ffc556d05ecb6bf973b0e54b834235ab7349e983b08e85e9804de533c7ce",
  "mode": "smoke",
  "operation": "export",
  "oracleResultRef": null,
  "reasonCode": "S05_OUTPUT_ORACLE_REJECTED",
  "requestRef": {
    "contentHash": "8d4c82dcebfa2927ca1c29b7e8384e69c7d44ffb32223debd4df9f1e4c33628f",
    "id": "request.export.83450daf67bf38c9.8c4624fdfbc287bf.r2.a1"
  },
  "resourceUsage": null,
  "resultId": "result.0e52ffc556d05ecb6bf973b0e54b834235ab7349e983b08e85e9804de533c7ce",
  "runtimeAttestationRef": {
    "byteLength": 10043,
    "contentHash": "8cc1073efbe5458aec8c49091554337061d64ebfa0fdb2654e0f3b2f89c18e47",
    "fileSha256": "acb3ba370b05c252ec6c4b2f237c10f54d8f31fa4c5cc75d98145ed8e5e80dc3",
    "id": "RUNTIME-SHARP-WIN32-X64@0.5.0",
    "inventoryPayloadSha256": "4fa94c4c225c8ec18abe2751cf4b2344bb643377750503df45a3c65bcfcd0972",
    "path": "runtime/attestation.win32-x64.v0.5.0.json"
  },
  "schemaVersion": "run-result.slice05.v0",
  "startedAt": "2026-08-15T04:52:08.654Z",
  "status": "nonpass",
  "workerExitConfirmed": null,
  "workerObservation": null,
  "workerRuntime": null
}
