{
  "artifactRef": null,
  "attempt": {
    "attemptNumber": 1,
    "idempotencyKey": "s05.smoke.normalize.792c7f641d26.54ac72b59f78.r3.a1",
    "partition": "smoke",
    "repetition": 3,
    "runId": "run.smoke.normalize.d914d75e54bb9b5e",
    "sourceId": "raw.s05.normalize.smoke.006"
  },
  "contentHash": "698aeed7b90401982a3a3f7b5b2c99a8d5a3bdcaf856b1fbd8e4ec100cdca184",
  "durationMs": null,
  "evidenceBoundary": {
    "c1": 0,
    "e1": 0,
    "formalEvidence": false,
    "g1": 0,
    "o1": 0,
    "productSupport": false,
    "r1Pipeline": 0,
    "r1ProductRelease": 0,
    "r1ProductValidation": 0,
    "releaseAllowlist": "none",
    "releaseApproved": 0,
    "releaseRegistered": 0,
    "u1": 0,
    "v1": 0
  },
  "expectedDisposition": "preflight-reject",
  "expectedStableErrorCode": "S05_NORMALIZE_SOURCE_DECLARATION_INVALID",
  "finishedAt": "2026-08-15T04:52:07.353Z",
  "idempotencyKeyHash": "d1ecd5681c093cd414c76ba0fa8f31ac2cf6184cfb40c29e4b12d7389652adea",
  "mode": "smoke",
  "operation": "normalize",
  "oracleResultRef": null,
  "reasonCode": "S05_NORMALIZE_SOURCE_DECLARATION_INVALID",
  "requestRef": {
    "contentHash": "54e1d7c186d20e16ad7990de1e11394bb66d9b763b2e9c4fd107d7d3b2b0d617",
    "id": "request.normalize.792c7f641d26a9d5.22c8bcc50c69d235.r3.a1"
  },
  "resourceUsage": null,
  "resultId": "result.d1ecd5681c093cd414c76ba0fa8f31ac2cf6184cfb40c29e4b12d7389652adea",
  "runtimeAttestationRef": {
    "byteLength": 10043,
    "contentHash": "8cc1073efbe5458aec8c49091554337061d64ebfa0fdb2654e0f3b2f89c18e47",
    "fileSha256": "acb3ba370b05c252ec6c4b2f237c10f54d8f31fa4c5cc75d98145ed8e5e80dc3",
    "id": "RUNTIME-SHARP-WIN32-X64@0.5.0",
    "inventoryPayloadSha256": "4fa94c4c225c8ec18abe2751cf4b2344bb643377750503df45a3c65bcfcd0972",
    "path": "runtime/attestation.win32-x64.v0.5.0.json"
  },
  "schemaVersion": "run-result.slice05.v0",
  "startedAt": "2026-08-15T04:52:07.346Z",
  "status": "pass",
  "workerExitConfirmed": null,
  "workerObservation": null,
  "workerRuntime": null
}
