{
  "artifactRef": null,
  "attempt": {
    "attemptNumber": 1,
    "idempotencyKey": "s05.smoke.export.83450daf67bf.dedfadf680c8.r2.a1",
    "partition": "smoke",
    "repetition": 2,
    "runId": "run.smoke.export.d914d75e54bb9b5e",
    "sourceId": "normalized.s05.export.smoke.006"
  },
  "contentHash": "41d59fb77913bc14ffdcf0b0cf3411e0f7120e31ffb31f64994f4cb2eda397a9",
  "durationMs": null,
  "evidenceBoundary": {
    "c1": 0,
    "e1": 0,
    "formalEvidence": false,
    "g1": 0,
    "o1": 0,
    "productSupport": false,
    "r1Pipeline": 0,
    "r1ProductRelease": 0,
    "r1ProductValidation": 0,
    "releaseAllowlist": "none",
    "releaseApproved": 0,
    "releaseRegistered": 0,
    "u1": 0,
    "v1": 0
  },
  "expectedDisposition": "preflight-reject",
  "expectedStableErrorCode": "S05_EXPORT_NORMALIZED_ARTIFACT_INVALID",
  "finishedAt": "2026-08-15T04:52:09.668Z",
  "idempotencyKeyHash": "9a80986cbc89fbf980ee6928620445680ecae0e47abe6db448b05cb529a627a7",
  "mode": "smoke",
  "operation": "export",
  "oracleResultRef": null,
  "reasonCode": "S05_EXPORT_NORMALIZED_ARTIFACT_INVALID",
  "requestRef": {
    "contentHash": "68d3b7d05a4b8224d7dac7470c6d5cb8044f6823097f48660d960bcbaa2413ec",
    "id": "request.export.83450daf67bf38c9.add092e6c562791f.r2.a1"
  },
  "resourceUsage": null,
  "resultId": "result.9a80986cbc89fbf980ee6928620445680ecae0e47abe6db448b05cb529a627a7",
  "runtimeAttestationRef": {
    "byteLength": 10043,
    "contentHash": "8cc1073efbe5458aec8c49091554337061d64ebfa0fdb2654e0f3b2f89c18e47",
    "fileSha256": "acb3ba370b05c252ec6c4b2f237c10f54d8f31fa4c5cc75d98145ed8e5e80dc3",
    "id": "RUNTIME-SHARP-WIN32-X64@0.5.0",
    "inventoryPayloadSha256": "4fa94c4c225c8ec18abe2751cf4b2344bb643377750503df45a3c65bcfcd0972",
    "path": "runtime/attestation.win32-x64.v0.5.0.json"
  },
  "schemaVersion": "run-result.slice05.v0",
  "startedAt": "2026-08-15T04:52:09.662Z",
  "status": "pass",
  "workerExitConfirmed": null,
  "workerObservation": null,
  "workerRuntime": null
}
