{
  "artifactRef": null,
  "attempt": {
    "attemptNumber": 1,
    "idempotencyKey": "s05.smoke.normalize.792c7f641d26.0f6c544bdb8b.r1.a1",
    "partition": "smoke",
    "repetition": 1,
    "runId": "run.smoke.normalize.d914d75e54bb9b5e",
    "sourceId": "raw.s05.normalize.smoke.005"
  },
  "contentHash": "b2a41506e2d952e1d6f5efe1392fe736e1979d1e3b7fad5848e6261e27d21eae",
  "durationMs": null,
  "evidenceBoundary": {
    "c1": 0,
    "e1": 0,
    "formalEvidence": false,
    "g1": 0,
    "o1": 0,
    "productSupport": false,
    "r1Pipeline": 0,
    "r1ProductRelease": 0,
    "r1ProductValidation": 0,
    "releaseAllowlist": "none",
    "releaseApproved": 0,
    "releaseRegistered": 0,
    "u1": 0,
    "v1": 0
  },
  "expectedDisposition": "preflight-reject",
  "expectedStableErrorCode": "S05_INPUT_SRGB_REQUIRED",
  "finishedAt": "2026-08-15T04:52:07.139Z",
  "idempotencyKeyHash": "5eb6c5baa13257b0a848d6e35c5029d9a08228b180575b06ab4d28c640f4570a",
  "mode": "smoke",
  "operation": "normalize",
  "oracleResultRef": null,
  "reasonCode": "S05_INPUT_CHUNK_PROFILE_INVALID",
  "requestRef": {
    "contentHash": "d9c88e7c9a8a521b8ee2cb0a3b2da6778be1bd67f5220600798a26114487d883",
    "id": "request.normalize.792c7f641d26a9d5.d831c363b1405316.r1.a1"
  },
  "resourceUsage": null,
  "resultId": "result.5eb6c5baa13257b0a848d6e35c5029d9a08228b180575b06ab4d28c640f4570a",
  "runtimeAttestationRef": {
    "byteLength": 10043,
    "contentHash": "8cc1073efbe5458aec8c49091554337061d64ebfa0fdb2654e0f3b2f89c18e47",
    "fileSha256": "acb3ba370b05c252ec6c4b2f237c10f54d8f31fa4c5cc75d98145ed8e5e80dc3",
    "id": "RUNTIME-SHARP-WIN32-X64@0.5.0",
    "inventoryPayloadSha256": "4fa94c4c225c8ec18abe2751cf4b2344bb643377750503df45a3c65bcfcd0972",
    "path": "runtime/attestation.win32-x64.v0.5.0.json"
  },
  "schemaVersion": "run-result.slice05.v0",
  "startedAt": "2026-08-15T04:52:07.134Z",
  "status": "nonpass",
  "workerExitConfirmed": null,
  "workerObservation": null,
  "workerRuntime": null
}
