{
  "artifactRef": null,
  "attempt": {
    "attemptNumber": 1,
    "idempotencyKey": "s05.smoke.normalize.792c7f641d26.489a789baf15.r1.a1",
    "partition": "smoke",
    "repetition": 1,
    "runId": "run.smoke.normalize.d914d75e54bb9b5e",
    "sourceId": "raw.s05.normalize.smoke.003"
  },
  "contentHash": "c4ae01e3edd6d1a68b55653d8a076fbe9c3dc3a78a293503f5989ee56b4b8785",
  "durationMs": null,
  "evidenceBoundary": {
    "c1": 0,
    "e1": 0,
    "formalEvidence": false,
    "g1": 0,
    "o1": 0,
    "productSupport": false,
    "r1Pipeline": 0,
    "r1ProductRelease": 0,
    "r1ProductValidation": 0,
    "releaseAllowlist": "none",
    "releaseApproved": 0,
    "releaseRegistered": 0,
    "u1": 0,
    "v1": 0
  },
  "expectedDisposition": "applicable",
  "expectedStableErrorCode": null,
  "finishedAt": "2026-08-15T04:52:06.660Z",
  "idempotencyKeyHash": "50426183a40502f6f076853cf81a66cfe563974f87702339b837e28f47b71a59",
  "mode": "smoke",
  "operation": "normalize",
  "oracleResultRef": null,
  "reasonCode": "S05_OUTPUT_ORACLE_REJECTED",
  "requestRef": {
    "contentHash": "4d11c091a59df429ce9d2edcc48f01b6c1f926c65b0994c05c3747566ebbccf6",
    "id": "request.normalize.792c7f641d26a9d5.02606c9a0976aa24.r1.a1"
  },
  "resourceUsage": null,
  "resultId": "result.50426183a40502f6f076853cf81a66cfe563974f87702339b837e28f47b71a59",
  "runtimeAttestationRef": {
    "byteLength": 10043,
    "contentHash": "8cc1073efbe5458aec8c49091554337061d64ebfa0fdb2654e0f3b2f89c18e47",
    "fileSha256": "acb3ba370b05c252ec6c4b2f237c10f54d8f31fa4c5cc75d98145ed8e5e80dc3",
    "id": "RUNTIME-SHARP-WIN32-X64@0.5.0",
    "inventoryPayloadSha256": "4fa94c4c225c8ec18abe2751cf4b2344bb643377750503df45a3c65bcfcd0972",
    "path": "runtime/attestation.win32-x64.v0.5.0.json"
  },
  "schemaVersion": "run-result.slice05.v0",
  "startedAt": "2026-08-15T04:52:06.523Z",
  "status": "nonpass",
  "workerExitConfirmed": null,
  "workerObservation": null,
  "workerRuntime": null
}
